{
  "serving": {
    "provider": "atlas-cloud",
    "observed_provider": "unrecorded",
    "observed_provider_source": "unrecorded",
    "quantization": "int4"
  },
  "env": {
    "image_digest": "sha256:00e24a8995892af9a0e1b68bc14ce455fae288d0f1ca8cf57e84a58e40e9f19e",
    "taskset_commit": "83e7b8fc75ebb6c4a098254a42999db5f4172666"
  },
  "run": {
    "repetition_index": 6,
    "total_repetitions": 10,
    "started_at": "2026-08-26T13:32:57.081338+00:00",
    "ended_at": "2026-08-26T13:45:35.244769+00:00"
  },
  "sampling": {
    "temperature": 0.0,
    "seed": 42
  },
  "steps": [],
  "verdict": {
    "criteria_version": "83e7b8fc75ebb6c4a098254a42999db5f4172666",
    "score": 1.0,
    "reason": null
  },
  "outcome": {
    "reason": "completed"
  },
  "harness": {
    "silent_retries": 2
  },
  "artefacts": {
    "observations": "per_step",
    "location": "archive/artifacts-shots.tar.gz:runs/A_temp0/MastodonImportMutedUsersTask/trial_006"
  },
  "task_id": "MastodonImportMutedUsersTask",
  "usage": {
    "completion_tokens": 6472,
    "prompt_tokens": 549615,
    "per_step_unavailable_reason": "MobileWorld's trajectory logger records one token_usage per run, not per step."
  }
}
