{
  "serving": {
    "provider": "atlas-cloud",
    "observed_provider": "unrecorded",
    "observed_provider_source": "unrecorded",
    "quantization": "int4"
  },
  "env": {
    "image_digest": "sha256:00e24a8995892af9a0e1b68bc14ce455fae288d0f1ca8cf57e84a58e40e9f19e",
    "taskset_commit": "83e7b8fc75ebb6c4a098254a42999db5f4172666"
  },
  "run": {
    "repetition_index": 6,
    "total_repetitions": 10,
    "started_at": "2026-08-26T14:03:41.182997+00:00",
    "ended_at": "2026-08-26T14:06:26.762469+00:00"
  },
  "sampling": {
    "temperature": 0.0,
    "seed": 42
  },
  "steps": [],
  "verdict": {
    "criteria_version": "83e7b8fc75ebb6c4a098254a42999db5f4172666",
    "score": null,
    "reason": null
  },
  "outcome": {
    "reason": "unknown"
  },
  "harness": {
    "silent_retries": 9
  },
  "artefacts": {
    "observations": "none"
  },
  "task_id": "ScheduleLunchViaSmsTask",
  "usage": {
    "completion_tokens": null,
    "prompt_tokens": null,
    "per_step_unavailable_reason": "no token_usage recorded for this run (outcome: no_result)"
  }
}
