{
  "serving": {
    "provider": "atlas-cloud",
    "observed_provider": "unrecorded",
    "observed_provider_source": "unrecorded",
    "quantization": "int4"
  },
  "env": {
    "image_digest": "sha256:00e24a8995892af9a0e1b68bc14ce455fae288d0f1ca8cf57e84a58e40e9f19e",
    "taskset_commit": "83e7b8fc75ebb6c4a098254a42999db5f4172666"
  },
  "run": {
    "repetition_index": 10,
    "total_repetitions": 10,
    "started_at": "2026-08-27T01:33:06.113027+00:00",
    "ended_at": "2026-08-27T01:41:48.630800+00:00"
  },
  "sampling": {
    "temperature": 0.0,
    "seed": 42
  },
  "steps": [],
  "verdict": {
    "criteria_version": "83e7b8fc75ebb6c4a098254a42999db5f4172666",
    "score": 0.0,
    "reason": "Bid files not renamed (missed): ['bid_restaurant_proposal.txt', 'bid_catering_menu_2024.doc', 'bid_menu_design_contract.pdf', 'bid_food_supplier_quote.txt']"
  },
  "outcome": {
    "reason": "budget_exhausted"
  },
  "harness": {
    "silent_retries": 0
  },
  "artefacts": {
    "observations": "per_step",
    "location": "archive/artifacts-shots.tar.gz:runs/A_temp0/BidFileRenameTask/trial_010"
  },
  "task_id": "BidFileRenameTask",
  "usage": {
    "completion_tokens": 4863,
    "prompt_tokens": 593056,
    "per_step_unavailable_reason": "MobileWorld's trajectory logger records one token_usage per run, not per step."
  }
}
