{
  "serving": {
    "provider": "atlas-cloud",
    "observed_provider": "unrecorded",
    "observed_provider_source": "unrecorded",
    "quantization": "int4"
  },
  "env": {
    "image_digest": "sha256:00e24a8995892af9a0e1b68bc14ce455fae288d0f1ca8cf57e84a58e40e9f19e",
    "taskset_commit": "83e7b8fc75ebb6c4a098254a42999db5f4172666"
  },
  "run": {
    "repetition_index": 9,
    "total_repetitions": 10,
    "started_at": "2026-08-27T00:31:12.305123+00:00",
    "ended_at": "2026-08-27T00:43:50.536684+00:00"
  },
  "sampling": {
    "temperature": 0.0,
    "seed": 42
  },
  "steps": [],
  "verdict": {
    "criteria_version": "83e7b8fc75ebb6c4a098254a42999db5f4172666",
    "score": 0.0,
    "reason": "URL mismatch: Which country has the largest land area? does not contain https://maps.app.goo.gl/xxxxxx"
  },
  "outcome": {
    "reason": "completed"
  },
  "harness": {
    "silent_retries": 1
  },
  "artefacts": {
    "observations": "none"
  },
  "task_id": "MastodonShareLocationTask",
  "usage": {
    "completion_tokens": 5446,
    "prompt_tokens": 532663,
    "per_step_unavailable_reason": "MobileWorld's trajectory logger records one token_usage per run, not per step."
  }
}
