{
  "serving": {
    "provider": "atlas-cloud",
    "observed_provider": "unrecorded",
    "observed_provider_source": "unrecorded",
    "quantization": "int4"
  },
  "env": {
    "image_digest": "sha256:00e24a8995892af9a0e1b68bc14ce455fae288d0f1ca8cf57e84a58e40e9f19e",
    "taskset_commit": "83e7b8fc75ebb6c4a098254a42999db5f4172666"
  },
  "run": {
    "repetition_index": 1,
    "total_repetitions": 10,
    "started_at": "2026-08-25T19:22:24.637973+00:00",
    "ended_at": "2026-08-25T19:32:03.464843+00:00"
  },
  "sampling": {
    "temperature": 0.0,
    "seed": 42
  },
  "steps": [],
  "verdict": {
    "criteria_version": "83e7b8fc75ebb6c4a098254a42999db5f4172666",
    "score": 1.0,
    "reason": null
  },
  "outcome": {
    "reason": "completed"
  },
  "harness": {
    "silent_retries": 1
  },
  "artefacts": {
    "observations": "none"
  },
  "task_id": "MattermostBudgetApprovalPipelineTask",
  "usage": {
    "completion_tokens": null,
    "prompt_tokens": null,
    "per_step_unavailable_reason": "no token_usage recorded for this run (outcome: scored)"
  }
}
